"","Term","Overlap","P.value","Adjusted.P.value","Old.P.value","Old.Adjusted.P.value","Odds.Ratio","Combined.Score","Genes"
"342","DNA metabolic process (GO:0006259)","1/277",0.719740776280865,0.792506602492108,0,0,0.790378421900161,0.25992713954885,"SMC1A"
"343","plasma membrane bounded cell projection assembly (GO:0120031)","1/278",0.721033858500778,0.792506602492108,0,0,0.78748495788207,0.257562061269419,"HYLS1"
"344","positive regulation of programmed cell death (GO:0043068)","1/286",0.731168305245623,0.801309450806976,0,0,0.765068226120858,0.239551740979787,"BNIP3"
"345","DNA repair (GO:0006281)","1/298",0.74569103012712,0.814856574950505,0,0,0.733707444818556,0.215301998499296,"SMC1A"
"346","innate immune response (GO:0045087)","1/302",0.75035733410774,0.816482715389545,0,0,0.723809523809524,0.207882250222444,"CARD9"
"347","MAPK cascade (GO:0000165)","1/303",0.751510616021676,0.816482715389545,0,0,0.721376011773363,0.206075444486743,"KITLG"
"348","positive regulation of apoptotic process (GO:0043065)","1/310",0.7594373666126,0.822723813830316,0,0,0.704782452355268,0.193940221800787,"BNIP3"
"349","cilium assembly (GO:0060271)","1/314",0.763854109347196,0.825137533592816,0,0,0.695633652822151,0.187388725183543,"HYLS1"
"350","cellular response to oxygen-containing compound (GO:1901701)","1/323",0.773500678664722,0.833170731018858,0,0,0.675879917184265,0.173585381827317,"CD80"
"351","cytokine-mediated signaling pathway (GO:0019221)","2/621",0.778727000531952,0.835091556261129,0,0,0.700295874099218,0.175140316757616,"RSAD2;CD80"
"352","cellular protein localization (GO:0034613)","1/329",0.779714132105881,0.835091556261129,0,0,0.663313008130081,0.165050798626091,"SEPTIN8"
"353","intracellular protein transport (GO:0006886)","1/336",0.786750350886663,0.840240459728816,0,0,0.64922056384743,0.155711849761585,"SNF8"
"354","cellular response to DNA damage stimulus (GO:0006974)","1/350",0.800162669926172,0.850733015378681,0,0,0.622731614135626,0.13883193213375,"SMC1A"
"355","supramolecular fiber organization (GO:0097435)","1/351",0.801088117929527,0.850733015378681,0,0,0.620920634920635,0.137710465797497,"ARHGAP25"
"356","protein transport (GO:0015031)","1/369",0.817039603891149,0.864599270924546,0,0,0.590006038647343,0.119221169423641,"ABCA1"
"357","positive regulation of protein phosphorylation (GO:0001934)","1/371",0.818731935596984,0.864599270924546,0,0,0.586756756756757,0.117350503880421,"CD80"
"358","negative regulation of programmed cell death (GO:0043069)","1/381",0.826964127499286,0.870853285103997,0,0,0.571023391812866,0.108490996355519,"BNIP3"
"359","positive regulation of macromolecule metabolic process (GO:0010604)","1/384",0.829360883680087,0.87094443773647,0,0,0.566463591528866,0.105985278196973,"SNF8"
"360","organelle organization (GO:0006996)","1/420",0.855683655409441,0.894116941072095,0,0,0.516839034738796,0.0805517061796681,"GOLGA8B"
"361","regulation of apoptotic process (GO:0042981)","2/742",0.856170333493438,0.894116941072095,0,0,0.582113574248406,0.0903940506008765,"TOMM70;BNIP3"
"362","negative regulation of nucleic acid-templated transcription (GO:1903507)","1/464",0.882455906892149,0.91902175938768,0,0,0.466666666666667,0.0583550124661039,"ZNF318"
"363","positive regulation of cell population proliferation (GO:0008284)","1/474",0.887818961310692,0.921819485153874,0,0,0.456565656565657,0.0543255737232654,"KITLG"
"364","cellular response to cytokine stimulus (GO:0071345)","1/482",0.891934543916741,0.921819485153874,0,0,0.448787248787249,0.0513244453618853,"CD80"
"365","negative regulation of apoptotic process (GO:0043066)","1/485",0.893439079761646,0.921819485153874,0,0,0.445936639118457,0.0502468598921942,"BNIP3"
"366","neutrophil mediated immunity (GO:0002446)","1/488",0.894922895401374,0.921819485153874,0,0,0.443121149897331,0.0491942974446798,"CARD9"
"367","positive regulation of transcription, DNA-templated (GO:0045893)","3/1183",0.911304223918346,0.936135401681789,0,0,0.541092064714946,0.0502558152440172,"ICE1;CD80;ZNF318"
"368","negative regulation of cellular macromolecule biosynthetic process (GO:2000113)","1/547",0.920283162021634,0.942790087179772,0,0,0.394037444037444,0.0327342159878024,"ZNF318"
"369","negative regulation of cellular process (GO:0048523)","1/566",0.927080771416292,0.947180083533718,0,0,0.380412979351032,0.028802810919388,"BNIP3"
"370","negative regulation of transcription, DNA-templated (GO:0045892)","2/948",0.933825186721811,0.951492149713845,0,0,0.450459652706844,0.0308411816283178,"ZNF318;MAFK"
"371","positive regulation of cellular process (GO:0048522)","1/625",0.944741118761897,0.960019950871254,0,0,0.343393874643875,0.0195199972779499,"KITLG"
"372","negative regulation of transcription by RNA polymerase II (GO:0000122)","1/684",0.958159639492616,0.971038129270742,0,0,0.312770457133561,0.0133680835101651,"MAFK"
"373","regulation of cell population proliferation (GO:0042127)","1/764",0.97134495889466,0.981761526818463,0,0,0.278811708169506,0.00810606350905848,"KITLG"
"374","cellular protein modification process (GO:0006464)","1/1025",0.991756403182239,0.996326698405116,0,0,0.204915364583333,0.00169624085598996,"CTDP1"
"375","regulation of gene expression (GO:0010468)","1/1079",0.993642905814008,0.996326698405116,0,0,0.194094001236858,0.00123781247394965,"SNF8"
"376","regulation of transcription, DNA-templated (GO:0006355)","4/2244",0.993683922016774,0.996326698405116,0,0,0.362664203612479,0.00229787984920396,"CD80;ZNF318;MAFK;SNF8"
"377","regulation of transcription by RNA polymerase II (GO:0006357)","3/2206",0.99821741359194,0.99821741359194,0,0,0.27399620352412,0.00048885775342111,"CTDP1;MAFK;SNF8"
